{
  "$schema": "./delivery.schema.json",
  "project": "my-project",
  "requirements": {
    "doc": "docs/requirements.md",
    "traceability": "docs/rtm.md"
  },
  "assertions": {
    "dir": "e2e/asserts",
    "pattern": "\\.(js|cjs|mjs|ts|spec\\.ts)$"
  },
  "visual": {
    "baseline": ".visual-baseline/baseline",
    "current": ".visual-baseline/current",
    "diffThreshold": 0.02,
    "diffOutput": ".visual-baseline/diff"
  },
  "gate": {
    "strict": false,
    "requireRTM": true,
    "requireAssertions": true,
    "requireVisual": true
  },
  "report": {
    "output": "docs/delivery-report.md"
  }
}
